{
  "id": "20261007-1540-ch02-highland-worker-a-portrait-serious-square-v2",
  "protocol_version": "2",
  "worker": "muse",
  "task_type": "canonical_reference",
  "reference_mode": "external_reference_first",
  "character": "npc_ch02_highland_worker_a",
  "action": "portrait_serious_square_v2",
  "action_vi": "Portrait serious bust, canvas vuông 1:1, không cạn mép (fix framing v1)",
  "asset_type": "reference_image",
  "reference_images": [
    "references/ch02/npc_ch02_highland_worker_a/canonical.png",
    "assets/20261005-0953-ch02-worried-resident-portrait-serious/canonical_reference_rgba.png",
    "references/style/ch02-npc-rendering/hero_warrior_male.png",
    "references/style/ch02-npc-rendering/hero_warrior_female.png",
    "references/style/ch02-npc-rendering/hero_tanker_male.png",
    "references/style/ch02-npc-rendering/hero_healer_female.png"
  ],
  "style_bible": "style-bibles/chapter02/README.md",
  "transparent_background": true,
  "runtime_cell_size": {
    "width": 320,
    "height": 480
  },
  "notes": "Chapter 2 Vietnamese-fantasy highland frontier. Ordinary STATIC NPC, NOT enemy/boss/guardian; no approval_policy classification. SINGLE reference-conditioned rendering of the supplied identity, NOT a new identity design. The FIRST attached image is the locked canonical identity: freeze face/hair/age/clothes/palette/proportions/accessories exactly. Hero references are STYLE ONLY, no costume bleed. Weathered earth/muted-green/indigo/brown cloth, subdued weary/worried/stoic tone. ONE dialogue portrait, expression serious ONLY: concerned/focused/burdened, no comic shock, no smile. NO chess motifs, modern industrial kit, armor, hero weapons, comedy, text/UI/watermark/scenery. No locomotion/walk/run/four-direction sheets; Trạm trưởng remains the only walking CH02 NPC with accepted art. Transparent alpha. FRAMING FIX v2 (root cause of v1 rejection): the previous version was rendered on a TALL full-body vertical canvas (e.g. 816x2512), so the runtime 320x480 downsample produced a narrow edge-touching strip with the head cut and no shoulder/chest breathing room. THIS VERSION MUST render on a SQUARE 1:1 canvas. Upper-body bust ONLY: top of head down to waist/belt, face readable, roughly 6-10% transparent margin on ALL four sides, NO content touching any canvas edge, no legs, no feet, no ground shadow, no drop shadow. The SECOND attached image is the ACCEPTED FRAMING REFERENCE (npc_ch02_worried_resident serious portrait, square master) - match its crop, headroom, side margin and bust length exactly. Deliver ONE high-resolution square RGBA master; Hermes downsamples to 320x480 runtime cell only after identity/alpha/framing QC. worker done means delivery only, not production approval. LOCKED IDENTITY: middle-aged male; tired worried face, slight stubble; tousled dark hair with subtle graying; patched brown practical long tunic, blue sash, dark-indigo trousers; small rope loop and wooden mallet tucked at sash. Identity per corrected reference v2 (independent actual-image QC passed).",
  "status": "pending"
}
