{
  "id": "20261005-2109-ch02-route-team-worker-2-portrait-serious-v1",
  "protocol_version": "2",
  "worker": "muse",
  "task_type": "canonical_reference",
  "approval_policy": "enemy_auto",
  "reference_mode": "external_reference_first",
  "character": "npc_ch02_route_team_worker_2",
  "action": "portrait_serious",
  "action_vi": "Một portrait serious đúng canonical đã QC; NPC dân sự static, không locomotion",
  "asset_type": "reference_image",
  "reference_images": [
    "references/canonical/ch02/npc_ch02_route_team_worker_2/canonical.png",
    "references/style/ch02-npc-rendering/hero_warrior_male.png",
    "references/style/ch02-npc-rendering/hero_warrior_female.png",
    "references/style/ch02-npc-rendering/hero_tanker_male.png",
    "references/style/ch02-npc-rendering/hero_healer_female.png"
  ],
  "style_bible": "style-bibles/chapter02/README.md",
  "transparent_background": true,
  "runtime_cell_size": {
    "width": 320,
    "height": 480
  },
  "status": "done",
  "notes": "CANDIDATE ONLY. Locked CH02 Scene01–09 only; no Scene10+, dialogue, story, personal names or lore. SINGLE reference-conditioned high-resolution portrait, NOT a new identity. The FIRST attached image is the accepted canonical identity; all other images are STYLE ONLY. Lean adult male, clean-shaven long face, short dark hair partly covered by muted olive cloth headwrap tied behind/side of head, tired calm brown eyes, worn rust-brown patched short tunic with rolled sleeves, grey trousers, faded linen sash, modest folded route paper map and plain small pouch. Freeze the actual attached face, headwrap, age, proportions and costume exactly. One calm/focused matter-of-fact serious expression ONLY; no broad smile, comic shock, panic, angry grimace, exaggerated drama or new costume/accessories. Upper-body dialogue bust, face legible, head/hair/shoulders safely inset, transparent RGBA alpha, painterly project-native style and muted palette. Render high-resolution master first; Hermes will normalize to320x480 only after identity/alpha/framing QC. No neutral/positive/surprised extra expressions; no sprite sheet/body regeneration. No armor, heroic weapons, chess motifs, modern industrial kit, scenery, text/UI or watermark. No locomotion/walk/run/4-direction art; only Trạm trưởng walks and already has accepted art. Do not touch accepted maps/Red Map/windmill/video assets. Return exactly one owner-declared high-resolution RGBA master PNG and asset.json binding the exact request, source SHA, result SHA and actual reference-conditioning metadata. Include actual provider-call/snapshot evidence if available; state gaps honestly rather than upgrading producer-attested claims. Status done means worker delivery, never production approval. Canonical source job 20261005-1810-ch02-route-team-worker-2-reference-v1, attested queue commit a4ded01c86fa5db410f2fa054f814d35e9af6c3c, source SHA256 34e91d9b168501aba4f75f73cc9dc4f8d3f21e687f858cc40918a492cadc9827. This new reference file is byte-identical to that inspected committed source."
}
