{
  "protocol_version": "2",
  "worker": "muse",
  "approval_policy": "enemy_auto",
  "style_bible": "style-bibles/chapter02/README.md",
  "transparent_background": true,
  "status": "done",
  "id": "20261005-1810-ch02-warning-bell-separated-parts-v1",
  "task_type": "prop_pack",
  "reference_mode": "external_reference_first",
  "character": "prop_ch02_warning_bell_indicator_component",
  "action": "separated_mechanism_parts",
  "action_vi": "Layer cố định/chuyển động độc lập, vá đúng chỗ bị che; không đổi identity",
  "asset_type": "prop_sheet",
  "frames": 3,
  "frames_vi": [
    "Layer 1: fixed_gantry; align shared parent coordinate plane, no extra art",
    "Layer 2: movable_bell; align shared parent coordinate plane, no extra art",
    "Layer 3: movable_indicator; align shared parent coordinate plane, no extra art"
  ],
  "runtime_cell_size": {
    "width": 512,
    "height": 768
  },
  "reference_images": [
    "references/ch02/act1_separated_mechanics_v1/warning-bell-indicator-accepted-reference.png"
  ],
  "postprocess": {
    "background_mode": "transparent_if_available",
    "extra_padding_px": 15,
    "max_repair_passes": 2,
    "export_individual_frames": true,
    "export_preview_gif": false
  },
  "notes": "CANDIDATE ONLY. Locked CH02 Scene01–09; do not create Scene10+, dialogue, story, personal names or lore. Only TRẠM TRƯỞNG walks: no walk/run/4-direction art. No Red Map, accepted map/background or original art changes. Ordinary production-asset enemy_auto policy; status done is not approval. Return owner-declared actual RGBA master PNG and asset.json with exact request/result/source image SHA and actual reference conditioning metadata; record real provider call/snapshot when available, honest gaps when unavailable. Never silently relabel reference_mode or change requester fields besides status. EXISTING INSPECTED REFERENCE LOCKED; stage2 SEPARATED PARTS ONLY. Fixed timber gantry/mast/braces/base/suspension support complete behind removed bell/indicator. Separate bell body and its attached clapper in one movable layer; separate side directional indicator around its real circular hub. All three align and reconstruct the accepted reference. Document bell swing attachment/pivot and indicator pivot, keep both readable, no HUD/dial text/boss face/newornament. Return individual same-camera/shared-scale aligned RGBA masters in exactly this logical layer order: fixed_gantry, movable_bell, movable_indicator. Each layer must use a coherent shared parent coordinate space (or explicit exact per-layer offsets/size in an owner-listed pivots.json) so composition reconstructs the original. No independent bboxfit/stretching or guessed rotation pivots. Repair/repaint only exposed occlusions, otherwise preserve accepted part identities. Work one part at a time at high resolution, not raw squarepack squeezing tall mast objects; a contact sheet may be an inspection/delivery aid only. No blind cutout rotations exposing holes. Owner-list and hash every individual part/master and pivots.json in asset.json; free-form part/pivot contract is notes-based, not claimed schema enforcement. No production path writes. Repaired source is candidate: independently visual/alpha/containment/reconstruction QC remains required; normal/slow/stop/reverse/calm runtime proof remains a separate gate."
}
