{
  "id": "20261004-1703-ch04-dieu-chien-reference",
  "protocol_version": "2",
  "worker": "muse",
  "task_type": "canonical_reference",
  "approval_policy": "enemy_auto",
  "reference_mode": "muse_self_reference",
  "action": "canonical_reference_candidate",
  "asset_type": "reference_image",
  "facing": "right",
  "style_bible": "style-bibles/chapter04/README.md",
  "transparent_background": true,
  "postprocess": {
    "background_mode": "white_key_if_needed",
    "extra_padding_px": 15,
    "max_repair_passes": 2,
    "segmentation": "connected_components",
    "export_individual_frames": false,
    "export_preview_gif": false
  },
  "status": "done",
  "character": "enemy_dieu_chien",
  "action_vi": "Tạo canonical reference candidate cho Diều Chiến: linh vật diều chiến bằng khung tre và vải cũ, bay thấp trên chiến trường, chuyên trinh sát/lao xuống tấn công.",
  "notes": "SELF-REFERENCE CANDIDATE ONLY. Traditional fantasy bamboo-and-cloth kite creature/construct, clearly pre-modern and NOT an aircraft/drone. Strong airborne side-view silhouette with bamboo ribs, weathered fabric and short trailing tails; child-friendly face can be implied by painted motif but no text. RIGHT-facing/dive-ready orientation, entire kite and tails in frame, transparent RGBA delivery. Candidate/non-canon; no animation rows yet."
}
