{
  "id": "20261004-1703-ch04-no-gio-reference",
  "protocol_version": "2",
  "worker": "muse",
  "task_type": "canonical_reference",
  "approval_policy": "enemy_auto",
  "reference_mode": "muse_self_reference",
  "action": "canonical_reference_candidate",
  "asset_type": "reference_image",
  "facing": "right",
  "style_bible": "style-bibles/chapter04/README.md",
  "transparent_background": true,
  "postprocess": {
    "background_mode": "white_key_if_needed",
    "extra_padding_px": 15,
    "max_repair_passes": 2,
    "segmentation": "connected_components",
    "export_individual_frames": false,
    "export_preview_gif": false
  },
  "status": "done",
  "character": "enemy_no_gio",
  "action_vi": "Tạo canonical reference candidate cho Nỏ Gió: nỏ gỗ cổ được gió chiến trường làm chuyển động, quái đánh xa, vật liệu gỗ sẫm/đồng/dây nỏ và dải vải chỉ hướng gió.",
  "notes": "SELF-REFERENCE CANDIDATE ONLY. Animated old wooden crossbow construct with bronze/iron fittings and a compact supporting frame/feet so it reads as a creature, not a dropped prop. RIGHT-facing ranged silhouette. Add small wind tassels/cloth strips for life and direction; no firearms, gun barrel or modern mechanisms. Full isolated form, generous margin, transparent RGBA delivery. Candidate/non-canon; no animation rows yet."
}
