{
  "id": "20261005-0926-ch02-highland-worker-a-reference-v1",
  "protocol_version": "2",
  "worker": "muse",
  "task_type": "canonical_reference",
  "reference_mode": "muse_self_reference",
  "character": "npc_ch02_highland_worker_a",
  "action": "canonical_reference",
  "action_vi": "Tham chiếu identity NPC tĩnh CH02, không locomotion",
  "asset_type": "reference_image",
  "reference_images": [
    "references/style/ch02-npc-rendering/hero_warrior_male.png",
    "references/style/ch02-npc-rendering/hero_warrior_female.png",
    "references/style/ch02-npc-rendering/hero_tanker_male.png",
    "references/style/ch02-npc-rendering/hero_healer_female.png"
  ],
  "style_bible": "style-bibles/chapter02/README.md",
  "transparent_background": true,
  "notes": "Chapter 2 Vietnamese-fantasy highland frontier. Canonical REFERENCE ONLY, one high-resolution full-body person, readable face/hair/age/clothes/footwear, neutral restrained pose, feet intact, generous margin, transparent RGBA or clean removable plain background. References are RENDERING STYLE ONLY: child-friendly painted JRPG proportions and finish, NOT identity/costume/hero roles. NO chess-piece hair ornament, rook/knight/pawn decoration, chess hat/badge/armor, party uniform, hero weapon, modern industrial kit, flashy armor, combat pose, scenery, text, UI, watermark, mascot/comedic styling or broad smile. Weathered practical fabric, earth/muted green/indigo/brown, rope/cloth/simple leather, practical mountain clothes. Emotion neutral-to-weary/worried/stoic, NOT cheerful. Deliver reference candidate only; STOP after canonical reference, no overworld, portraits or animation until independent identity PASS. Ordinary NPC: no boss/guardian/enemy classification. All downstream NPC overworld outputs are STATIC ONE IMAGE. No locomotion, walk/run cycles or four-direction sheets. Trạm trưởng is the ONLY walking NPC and already has accepted art; do not generate him.\nROLE: Middle-aged male construction / route-safety worker, weathered face, short black hair with some grey, sturdy ordinary build, muted earth-brown tunic, indigo practical trousers, cloth sash, simple worn footwear, modest rope loop on belt, no weapon. Burdened focused expression. Serves Scene04 checkpoint and worker/reporting reuse, Scene06 worker1. Downstream portrait expression actually planned: serious only.",
  "status": "pending"
}
